{
  "schema_version": "1.0",
  "timeline_snapshot_id": "timeline-c306992c4b2adec3",
  "content_sha256": "c306992c4b2adec39b1b994cc04230634c2c5a722503c32a83b871b989320883",
  "subject_ref": "subject-synthetic-stage05-001",
  "policy_version": "longitudinal-policy-v1",
  "source_dataset_snapshot_ids": [
    "ds-d1",
    "ds-d2"
  ],
  "lineage_groups": [
    {
      "logical_measurement_id": "lm-9d7008be6be9c09a",
      "member_observation_ids": [
        "d1",
        "d2"
      ],
      "selected_observation_id": "d1",
      "resolution": "duplicate_collapsed",
      "evidence_basis": "same_source_identity_idempotent_payload"
    }
  ],
  "series": [
    {
      "series_id": "series-edf2309678a19b77",
      "canonical_test": {
        "system": "http://loinc.org",
        "code": "5804-0",
        "display": "Synthetic 5804-0",
        "version": "2.83"
      },
      "value_kind": "quantity",
      "points": [
        {
          "logical_measurement_id": "lm-9d7008be6be9c09a",
          "selected_observation_id": "d1",
          "effective_at": "2026-01-01T08:00:00Z",
          "issued_at": "2026-01-01T10:00:00Z",
          "source_dataset_snapshot_id": "ds-d1",
          "value": {
            "kind": "quantity",
            "value": 30,
            "unit_ucum": "mg/dL",
            "source_text": "30"
          }
        }
      ],
      "normalized_unit": "mg/dL",
      "trend": {
        "status": "insufficient_points"
      }
    }
  ],
  "excluded_observations": []
}