{
  "schema_version": "1.0",
  "timeline_snapshot_id": "timeline-5c33fc1faf5401d2",
  "content_sha256": "5c33fc1faf5401d28acff7b6b14ff3076c4e180d5f5f6622b92ee15bcb5f4edd",
  "subject_ref": "subject-synthetic-stage05-001",
  "policy_version": "longitudinal-policy-v1",
  "source_dataset_snapshot_ids": [
    "ds-o1",
    "ds-o2"
  ],
  "lineage_groups": [
    {
      "logical_measurement_id": "lm-4ccc7e58e81bbb69",
      "member_observation_ids": [
        "o2"
      ],
      "selected_observation_id": "o2",
      "resolution": "unique",
      "evidence_basis": "single_representation"
    },
    {
      "logical_measurement_id": "lm-d920812bbadcb548",
      "member_observation_ids": [
        "o1"
      ],
      "selected_observation_id": "o1",
      "resolution": "unique",
      "evidence_basis": "single_representation"
    }
  ],
  "series": [
    {
      "series_id": "series-51d0d33de8135881",
      "canonical_test": {
        "system": "http://loinc.org",
        "code": "5799-2",
        "display": "Synthetic 5799-2",
        "version": "2.83"
      },
      "value_kind": "ordinal",
      "points": [
        {
          "logical_measurement_id": "lm-d920812bbadcb548",
          "selected_observation_id": "o1",
          "effective_at": "2026-01-01T08:00:00Z",
          "issued_at": "2026-01-01T09:00:00Z",
          "source_dataset_snapshot_id": "ds-o1",
          "value": {
            "kind": "ordinal",
            "source_text": "Negative",
            "rank": 0,
            "normalized_code": "negative"
          }
        },
        {
          "logical_measurement_id": "lm-4ccc7e58e81bbb69",
          "selected_observation_id": "o2",
          "effective_at": "2026-02-01T08:00:00Z",
          "issued_at": "2026-02-01T09:00:00Z",
          "source_dataset_snapshot_id": "ds-o2",
          "value": {
            "kind": "ordinal",
            "source_text": "1+",
            "rank": 2,
            "normalized_code": "1_plus"
          }
        }
      ],
      "trend": {
        "status": "computed_ordinal",
        "direction": "increased",
        "rank_delta": 2
      }
    }
  ],
  "excluded_observations": []
}